[{"id":100,"first_name":"Jereme","last_name":"Brigstock","email":"jbrigstock2r@pinterest.com","role":"Research Associate","company_id":70},
{"id":101,"first_name":"Arlen","last_name":"Ragdale","email":"aragdale2s@sohu.com","role":"Senior Quality Engineer","company_id":29},
{"id":102,"first_name":"Redd","last_name":"Philipard","email":"rphilipard2t@ucsd.edu","role":"Executive Secretary","company_id":91},
{"id":103,"first_name":"Gavin","last_name":"Peagrim","email":"gpeagrim2u@wikispaces.com","role":"Marketing Manager","company_id":29},
{"id":104,"first_name":"Amabel","last_name":"Ramsey","email":"aramsey2v@nature.com","role":"Administrative Assistant II","company_id":52},
{"id":105,"first_name":"Deloris","last_name":"Jinda","email":"djinda2w@amazonaws.com","role":"Database Administrator I","company_id":9},
{"id":106,"first_name":"Elsey","last_name":"Samter","email":"esamter2x@netvibes.com","role":"Senior Editor","company_id":48},
{"id":107,"first_name":"Dorthea","last_name":"Tathacott","email":"dtathacott2y@paginegialle.it","role":"Software Engineer I","company_id":73},
{"id":108,"first_name":"Ronni","last_name":"Jarad","email":"rjarad2z@friendfeed.com","role":"Community Outreach Specialist","company_id":13},
{"id":109,"first_name":"Gerry","last_name":"Chidlow","email":"gchidlow30@wisc.edu","role":"Tax Accountant","company_id":37},
{"id":110,"first_name":"Glory","last_name":"Jorck","email":"gjorck31@accuweather.com","role":"Environmental Tech","company_id":50},
{"id":111,"first_name":"Bald","last_name":"Pepperd","email":"bpepperd32@jiathis.com","role":null,"company_id":9},
{"id":112,"first_name":"Colas","last_name":"Jessop","email":"cjessop33@ebay.com","role":"Payment Adjustment Coordinator","company_id":7},
{"id":113,"first_name":"Amalea","last_name":"Bowling","email":"abowling34@comcast.net","role":"Senior Developer","company_id":48},
{"id":114,"first_name":"Melany","last_name":"Berrane","email":"mberrane35@techcrunch.com","role":"Human Resources Assistant IV","company_id":66},
{"id":115,"first_name":"Fannie","last_name":"Mulderrig","email":"fmulderrig36@cyberchimps.com","role":"Dental Hygienist","company_id":91},
{"id":116,"first_name":"Willy","last_name":"Adamson","email":"wadamson37@about.me","role":"Environmental Specialist","company_id":69},
{"id":117,"first_name":"Brenda","last_name":"Parsall","email":"bparsall38@wisc.edu","role":null,"company_id":28},
{"id":118,"first_name":"Maible","last_name":"Trematick","email":null,"role":"Staff Scientist","company_id":82},
{"id":119,"first_name":"Layla","last_name":"Cordova","email":"lcordova3a@naver.com","role":"Statistician II","company_id":41},
{"id":120,"first_name":"Broddy","last_name":"Kalinsky","email":"bkalinsky3b@google.es","role":"Data Coordinator","company_id":29},
{"id":121,"first_name":"Merline","last_name":"Ettles","email":"mettles3c@pcworld.com","role":"Database Administrator IV","company_id":96},
{"id":122,"first_name":"Abbie","last_name":"Shapter","email":"ashapter3d@nymag.com","role":"Desktop Support Technician","company_id":17},
{"id":123,"first_name":"Gunar","last_name":"Aubrey","email":"gaubrey3e@tmall.com","role":"Software Engineer IV","company_id":8},
{"id":124,"first_name":"Berthe","last_name":"Risso","email":"brisso3f@nifty.com","role":"Health Coach III","company_id":89},
{"id":125,"first_name":"Gloriana","last_name":"Pretti","email":"gpretti3g@netlog.com","role":"Electrical Engineer","company_id":null},
{"id":126,"first_name":"Debby","last_name":"Haistwell","email":"dhaistwell3h@marriott.com","role":"Desktop Support Technician","company_id":97}]