[{"id":187,"first_name":"Zak","last_name":"Cloughton","email":"zcloughton56@myspace.com","role":"Senior Sales Associate","company_id":69},
{"id":188,"first_name":"Timofei","last_name":"Pietraszek","email":"tpietraszek57@infoseek.co.jp","role":"Health Coach I","company_id":39},
{"id":189,"first_name":"Erin","last_name":"Picknett","email":"epicknett58@sphinn.com","role":"Editor","company_id":54},
{"id":190,"first_name":"Murdoch","last_name":"Dicey","email":"mdicey59@dailymotion.com","role":"Design Engineer","company_id":38},
{"id":191,"first_name":"Vanny","last_name":"Kliement","email":"vkliement5a@answers.com","role":"Food Chemist","company_id":47},
{"id":192,"first_name":"Francklin","last_name":"Lobb","email":"flobb5b@pbs.org","role":"Project Manager","company_id":93},
{"id":193,"first_name":"Brittani","last_name":"Chezier","email":"bchezier5c@weibo.com","role":"Chemical Engineer","company_id":48},
{"id":194,"first_name":"Leeanne","last_name":"Tome","email":"ltome5d@parallels.com","role":"Actuary","company_id":39},
{"id":195,"first_name":"Chad","last_name":"Lynock","email":"clynock5e@biglobe.ne.jp","role":"Civil Engineer","company_id":67},
{"id":196,"first_name":"Jackson","last_name":"Hardern","email":"jhardern5f@xrea.com","role":"GIS Technical Architect","company_id":23},
{"id":197,"first_name":"Lindy","last_name":"Headrick","email":"lheadrick5g@princeton.edu","role":"Structural Engineer","company_id":82},
{"id":198,"first_name":"Aprilette","last_name":"Minthorpe","email":"aminthorpe5h@hostgator.com","role":"Actuary","company_id":44},
{"id":199,"first_name":"Isobel","last_name":"Lamasna","email":"ilamasna5i@gnu.org","role":"Research Associate","company_id":45},
{"id":200,"first_name":"Karry","last_name":"Balthasar","email":"kbalthasar5j@flavors.me","role":"Geologist I","company_id":69}]