[{"id":28,"first_name":"Izzy","last_name":"Moorhouse","email":"imoorhouser@sphinn.com","role":"Geologist IV","company_id":23},
{"id":29,"first_name":"Janice","last_name":"Maultby","email":"jmaultbys@google.com","role":"Structural Engineer","company_id":33},
{"id":30,"first_name":"Harwell","last_name":"Gurnell","email":"hgurnellt@nbcnews.com","role":"Payment Adjustment Coordinator","company_id":null},
{"id":31,"first_name":"Merrel","last_name":"De Lorenzo","email":"mdelorenzou@prnewswire.com","role":"Assistant Media Planner","company_id":25},
{"id":32,"first_name":"Shurwood","last_name":"Emmens","email":"semmensv@jugem.jp","role":"General Manager","company_id":92},
{"id":33,"first_name":"Agosto","last_name":"Gilstin","email":"agilstinw@skyrock.com","role":"Speech Pathologist","company_id":51},
{"id":34,"first_name":"Cherida","last_name":"Petran","email":"cpetranx@bigcartel.com","role":"Quality Control Specialist","company_id":27},
{"id":35,"first_name":"Barny","last_name":"Orpyne","email":null,"role":"Human Resources Manager","company_id":null},
{"id":36,"first_name":"Dewitt","last_name":"Richmont","email":"drichmontz@cisco.com","role":"Editor","company_id":16},
{"id":37,"first_name":"Berk","last_name":"Roark","email":"broark10@shop-pro.jp","role":"Chief Design Engineer","company_id":49},
{"id":38,"first_name":"Kristal","last_name":"Alessandrelli","email":"kalessandrelli11@photobucket.com","role":"Accounting Assistant I","company_id":100}]