[{"id":81,"first_name":"Marsh","last_name":"Bedell","email":"mbedell28@theguardian.com","role":"Financial Analyst","company_id":97},
{"id":82,"first_name":"Odelia","last_name":"Lodewick","email":"olodewick29@whitehouse.gov","role":"Associate Professor","company_id":12},
{"id":83,"first_name":"Marys","last_name":"Hatrey","email":"mhatrey2a@cam.ac.uk","role":"Nurse","company_id":45},
{"id":84,"first_name":"Evey","last_name":"Lower","email":"elower2b@multiply.com","role":"Librarian","company_id":null},
{"id":85,"first_name":"Chadd","last_name":"Faucett","email":"cfaucett2c@youtu.be","role":"VP Product Management","company_id":62},
{"id":86,"first_name":"Meggy","last_name":"Barth","email":"mbarth2d@examiner.com","role":"Human Resources Assistant II","company_id":32},
{"id":87,"first_name":"Bernice","last_name":"Tows","email":"btows2e@amazon.de","role":"Geologist II","company_id":35},
{"id":88,"first_name":"Ches","last_name":"Pristnor","email":"cpristnor2f@shinystat.com","role":"Senior Cost Accountant","company_id":8},
{"id":89,"first_name":"Mona","last_name":"O'Glessane","email":"moglessane2g@trellian.com","role":"Help Desk Operator","company_id":68},
{"id":90,"first_name":"Eudora","last_name":"Kollatsch","email":"ekollatsch2h@php.net","role":"Office Assistant IV","company_id":40},
{"id":91,"first_name":"Kelcy","last_name":"Marling","email":null,"role":"Community Outreach Specialist","company_id":21},
{"id":92,"first_name":"Aubrie","last_name":"Bourdas","email":"abourdas2j@blogs.com","role":"Physical Therapy Assistant","company_id":52},
{"id":93,"first_name":"Wilone","last_name":"Wadeson","email":"wwadeson2k@cbc.ca","role":"Help Desk Technician","company_id":2},
{"id":94,"first_name":"Gabey","last_name":"Hawkett","email":"ghawkett2l@altervista.org","role":"Senior Cost Accountant","company_id":null},
{"id":95,"first_name":"Frederick","last_name":"Housby","email":"fhousby2m@census.gov","role":"Help Desk Technician","company_id":71},
{"id":96,"first_name":"Gran","last_name":"Banat","email":"gbanat2n@angelfire.com","role":"Assistant Media Planner","company_id":69},
{"id":97,"first_name":"Waylin","last_name":"Meneux","email":"wmeneux2o@cloudflare.com","role":"Developer III","company_id":36},
{"id":98,"first_name":"Nickie","last_name":"Le feaver","email":"nlefeaver2p@cam.ac.uk","role":"Financial Analyst","company_id":66},
{"id":99,"first_name":"Tabbie","last_name":"Jerrolt","email":"tjerrolt2q@4shared.com","role":"Research Assistant I","company_id":56}]