[{"id":164,"first_name":"Celeste","last_name":"Bulteel","email":"cbulteel4j@dell.com","role":"Sales Representative","company_id":70},
{"id":165,"first_name":"Veronique","last_name":"Sidnall","email":"vsidnall4k@businessinsider.com","role":"Nuclear Power Engineer","company_id":56},
{"id":166,"first_name":"Auria","last_name":"Boram","email":"aboram4l@sogou.com","role":"Senior Sales Associate","company_id":94},
{"id":167,"first_name":"Fayre","last_name":"Giddings","email":"fgiddings4m@51.la","role":"Office Assistant II","company_id":89},
{"id":168,"first_name":"Reynold","last_name":"Yanyushkin","email":"ryanyushkin4n@home.pl","role":"Web Designer I","company_id":30},
{"id":169,"first_name":"Vale","last_name":"Hayton","email":"vhayton4o@seesaa.net","role":"Operator","company_id":96},
{"id":170,"first_name":"Lynette","last_name":"Riddington","email":"lriddington4p@oakley.com","role":"Human Resources Assistant III","company_id":65},
{"id":171,"first_name":"Gifford","last_name":"Hellwig","email":null,"role":null,"company_id":99},
{"id":172,"first_name":"Joletta","last_name":"Mecozzi","email":null,"role":"Information Systems Manager","company_id":35},
{"id":173,"first_name":"Nola","last_name":"Domange","email":"ndomange4s@youtube.com","role":"Administrative Assistant IV","company_id":74},
{"id":174,"first_name":"Sawyer","last_name":"Ruffli","email":"sruffli4t@unicef.org","role":"Analog Circuit Design manager","company_id":58},
{"id":175,"first_name":"Philip","last_name":"Slott","email":null,"role":"Staff Scientist","company_id":92},
{"id":176,"first_name":"Randa","last_name":"Callister","email":"rcallister4v@howstuffworks.com","role":"Senior Sales Associate","company_id":11},
{"id":177,"first_name":"Abagael","last_name":"Cuthbertson","email":"acuthbertson4w@tinyurl.com","role":"Software Engineer II","company_id":94},
{"id":178,"first_name":"Betteanne","last_name":"Brocklehurst","email":"bbrocklehurst4x@jimdo.com","role":"Financial Analyst","company_id":52},
{"id":179,"first_name":"Mendie","last_name":"Jirusek","email":"mjirusek4y@weebly.com","role":"Editor","company_id":94},
{"id":180,"first_name":"Leanna","last_name":"Brane","email":"lbrane4z@google.pl","role":"Human Resources Assistant III","company_id":44},
{"id":181,"first_name":"Corey","last_name":"Cremer","email":"ccremer50@dailymotion.com","role":"Systems Administrator III","company_id":70},
{"id":182,"first_name":"Zandra","last_name":"Juett","email":"zjuett51@uiuc.edu","role":"Data Coordinator","company_id":33},
{"id":183,"first_name":"Dyann","last_name":"O'Dwyer","email":"dodwyer52@umich.edu","role":"Analyst Programmer","company_id":62},
{"id":184,"first_name":"Maure","last_name":"Masden","email":"mmasden53@studiopress.com","role":"Librarian","company_id":26},
{"id":185,"first_name":"Aimee","last_name":"Glynne","email":"aglynne54@washingtonpost.com","role":"Cost Accountant","company_id":51},
{"id":186,"first_name":"Ruperta","last_name":"Walkingshaw","email":"rwalkingshaw55@ucsd.edu","role":"Senior Quality Engineer","company_id":53}]