[{"id":127,"first_name":"Earlie","last_name":"Eccersley","email":"eeccersley3i@cbsnews.com","role":"Assistant Media Planner","company_id":54},
{"id":128,"first_name":"Adrien","last_name":"Weedon","email":"aweedon3j@skype.com","role":"Nurse","company_id":39},
{"id":129,"first_name":"Ramsay","last_name":"Mitroshinov","email":"rmitroshinov3k@yandex.ru","role":"Design Engineer","company_id":null}]