[{"id":9,"first_name":"Gustav","last_name":"Seiler","email":"gseiler8@alibaba.com","role":"Human Resources Manager","company_id":25},
{"id":10,"first_name":"Dar","last_name":"Killingworth","email":null,"role":"VP Product Management","company_id":25},
{"id":11,"first_name":"Caroljean","last_name":"Cancellario","email":"ccancellarioa@fastcompany.com","role":"Chemical Engineer","company_id":26}]